{
  "schema_version": "evidence-evaluation.v1",
  "evaluation_id": "44444444-4444-4444-8444-444444444444",
  "source": "global_cam_01",
  "view": "full",
  "operation": "MONITOR",
  "expected_evidence_type": "ITEM_DROPPED_CANDIDATE",
  "proposed_event_type": "ITEM_DROPPED_CANDIDATE",
  "verification_status": "PASS",
  "validity": "VALID_CANDIDATE",
  "reason_code": "DROPPED_ITEM_DETECTED",
  "confidence": 0.82,
  "trusted": false,
  "image_uri": "/api/v1/evidence/images/global_cam_01/full/2026-06-24/dropped-item-candidate-44444444-4444-4444-8444-444444444444.jpg",
  "task_ref": {
    "task_id": 123,
    "command_id": 789,
    "location_id": "AISLE_01"
  },
  "data_json": {
    "ai_judgement": {
      "verification_status": "PASS",
      "validity": "VALID_CANDIDATE",
      "reason_code": "DROPPED_ITEM_DETECTED",
      "expected_count": null,
      "observed_count": 1,
      "stable_frames": 2
    },
    "original_contract": "vision-event.v1",
    "original_payload": {
      "event_kind": "CANDIDATE",
      "class_name": "dropped_item",
      "wms_hint": "DROPPED_ITEM_CANDIDATE"
    }
  },
  "observed_at": "2026-06-24T17:13:00+09:00"
}
