{
  "schema_version": "evidence-evaluation.v1",
  "evaluation_id": "33333333-3333-4333-8333-333333333333",
  "source": "global_cam_01",
  "view": "lift_roi",
  "operation": "PICKUP",
  "expected_evidence_type": "ITEM_PICKED",
  "proposed_event_type": null,
  "verification_status": "UNCERTAIN",
  "validity": "NEEDS_REVIEW",
  "reason_code": "NO_FRAME",
  "confidence": null,
  "trusted": false,
  "image_uri": null,
  "task_ref": {
    "task_id": 123,
    "command_id": 456,
    "location_id": "STORAGE_A_01"
  },
  "data_json": {
    "ai_judgement": {
      "verification_status": "UNCERTAIN",
      "validity": "NEEDS_REVIEW",
      "reason_code": "NO_FRAME",
      "expected_count": 1,
      "observed_count": null,
      "stable_frames": 0
    },
    "original_contract": null,
    "original_payload": null
  },
  "observed_at": "2026-06-24T17:12:00+09:00"
}
